{
  "schema_version": "1.0",
  "asset_id": "body-neutral-procedural-v1",
  "asset_version": "1.2.0",
  "topology_id": "body-neutral-procedural-topology-v2",
  "collision_mesh_id": "body_collision_v1",
  "collision_triangle_count": 1904,
  "entries": [
    {
      "entry_id": "000",
      "mesh_id": "body_abdomen",
      "collision_mesh_id": "body_collision_v1",
      "face_start": 0,
      "face_end": 79,
      "region_id": "body.abdomen.general",
      "laterality": "midline",
      "surface": "anterior",
      "confidence": 0.86,
      "boundary_candidates": []
    },
    {
      "entry_id": "001",
      "mesh_id": "body_head",
      "collision_mesh_id": "body_collision_v1",
      "face_start": 80,
      "face_end": 159,
      "region_id": "body.head.general",
      "laterality": "midline",
      "surface": "circumferential",
      "confidence": 0.86,
      "boundary_candidates": []
    },
    {
      "entry_id": "002",
      "mesh_id": "body_left_calf",
      "collision_mesh_id": "body_collision_v1",
      "face_start": 160,
      "face_end": 199,
      "region_id": "body.calf.general",
      "laterality": "left",
      "surface": "lateral",
      "confidence": 0.86,
      "boundary_candidates": []
    },
    {
      "entry_id": "003",
      "mesh_id": "body_left_chest",
      "collision_mesh_id": "body_collision_v1",
      "face_start": 200,
      "face_end": 279,
      "region_id": "body.chest.general",
      "laterality": "left",
      "surface": "anterior",
      "confidence": 0.86,
      "boundary_candidates": []
    },
    {
      "entry_id": "004",
      "mesh_id": "body_left_elbow",
      "collision_mesh_id": "body_collision_v1",
      "face_start": 280,
      "face_end": 359,
      "region_id": "body.elbow.general",
      "laterality": "left",
      "surface": "lateral",
      "confidence": 0.86,
      "boundary_candidates": []
    },
    {
      "entry_id": "005",
      "mesh_id": "body_left_foot",
      "collision_mesh_id": "body_collision_v1",
      "face_start": 360,
      "face_end": 371,
      "region_id": "body.ankle_foot.general",
      "laterality": "left",
      "surface": "lateral",
      "confidence": 0.86,
      "boundary_candidates": []
    },
    {
      "entry_id": "006",
      "mesh_id": "body_left_forearm",
      "collision_mesh_id": "body_collision_v1",
      "face_start": 372,
      "face_end": 411,
      "region_id": "body.forearm.general",
      "laterality": "left",
      "surface": "lateral",
      "confidence": 0.86,
      "boundary_candidates": []
    },
    {
      "entry_id": "007",
      "mesh_id": "body_left_hand",
      "collision_mesh_id": "body_collision_v1",
      "face_start": 412,
      "face_end": 491,
      "region_id": "body.hand.general",
      "laterality": "left",
      "surface": "lateral",
      "confidence": 0.86,
      "boundary_candidates": []
    },
    {
      "entry_id": "008",
      "mesh_id": "body_left_hip",
      "collision_mesh_id": "body_collision_v1",
      "face_start": 492,
      "face_end": 571,
      "region_id": "body.hip.general",
      "laterality": "left",
      "surface": "lateral",
      "confidence": 0.86,
      "boundary_candidates": []
    },
    {
      "entry_id": "009",
      "mesh_id": "body_left_knee",
      "collision_mesh_id": "body_collision_v1",
      "face_start": 572,
      "face_end": 651,
      "region_id": "body.knee.general",
      "laterality": "left",
      "surface": "lateral",
      "confidence": 0.86,
      "boundary_candidates": []
    },
    {
      "entry_id": "010",
      "mesh_id": "body_left_shoulder",
      "collision_mesh_id": "body_collision_v1",
      "face_start": 652,
      "face_end": 731,
      "region_id": "body.shoulder.general",
      "laterality": "left",
      "surface": "lateral",
      "confidence": 0.86,
      "boundary_candidates": []
    },
    {
      "entry_id": "011",
      "mesh_id": "body_left_thigh",
      "collision_mesh_id": "body_collision_v1",
      "face_start": 732,
      "face_end": 771,
      "region_id": "body.thigh.general",
      "laterality": "left",
      "surface": "lateral",
      "confidence": 0.86,
      "boundary_candidates": []
    },
    {
      "entry_id": "012",
      "mesh_id": "body_left_upper_arm",
      "collision_mesh_id": "body_collision_v1",
      "face_start": 772,
      "face_end": 811,
      "region_id": "body.upper_arm.general",
      "laterality": "left",
      "surface": "lateral",
      "confidence": 0.86,
      "boundary_candidates": []
    },
    {
      "entry_id": "013",
      "mesh_id": "body_left_upper_back",
      "collision_mesh_id": "body_collision_v1",
      "face_start": 812,
      "face_end": 891,
      "region_id": "body.upper_back.general",
      "laterality": "left",
      "surface": "posterior",
      "confidence": 0.86,
      "boundary_candidates": []
    },
    {
      "entry_id": "014",
      "mesh_id": "body_lower_back",
      "collision_mesh_id": "body_collision_v1",
      "face_start": 892,
      "face_end": 971,
      "region_id": "body.lower_back.general",
      "laterality": "midline",
      "surface": "posterior",
      "confidence": 0.86,
      "boundary_candidates": []
    },
    {
      "entry_id": "015",
      "mesh_id": "body_neck",
      "collision_mesh_id": "body_collision_v1",
      "face_start": 972,
      "face_end": 1011,
      "region_id": "body.neck.general",
      "laterality": "midline",
      "surface": "circumferential",
      "confidence": 0.86,
      "boundary_candidates": []
    },
    {
      "entry_id": "016",
      "mesh_id": "body_pelvis",
      "collision_mesh_id": "body_collision_v1",
      "face_start": 1012,
      "face_end": 1091,
      "region_id": "body.pelvis.general",
      "laterality": "midline",
      "surface": "circumferential",
      "confidence": 0.86,
      "boundary_candidates": []
    },
    {
      "entry_id": "017",
      "mesh_id": "body_right_calf",
      "collision_mesh_id": "body_collision_v1",
      "face_start": 1092,
      "face_end": 1131,
      "region_id": "body.calf.general",
      "laterality": "right",
      "surface": "lateral",
      "confidence": 0.86,
      "boundary_candidates": []
    },
    {
      "entry_id": "018",
      "mesh_id": "body_right_chest",
      "collision_mesh_id": "body_collision_v1",
      "face_start": 1132,
      "face_end": 1211,
      "region_id": "body.chest.general",
      "laterality": "right",
      "surface": "anterior",
      "confidence": 0.86,
      "boundary_candidates": []
    },
    {
      "entry_id": "019",
      "mesh_id": "body_right_elbow",
      "collision_mesh_id": "body_collision_v1",
      "face_start": 1212,
      "face_end": 1291,
      "region_id": "body.elbow.general",
      "laterality": "right",
      "surface": "lateral",
      "confidence": 0.86,
      "boundary_candidates": []
    },
    {
      "entry_id": "020",
      "mesh_id": "body_right_foot",
      "collision_mesh_id": "body_collision_v1",
      "face_start": 1292,
      "face_end": 1303,
      "region_id": "body.ankle_foot.general",
      "laterality": "right",
      "surface": "lateral",
      "confidence": 0.86,
      "boundary_candidates": []
    },
    {
      "entry_id": "021",
      "mesh_id": "body_right_forearm",
      "collision_mesh_id": "body_collision_v1",
      "face_start": 1304,
      "face_end": 1343,
      "region_id": "body.forearm.general",
      "laterality": "right",
      "surface": "lateral",
      "confidence": 0.86,
      "boundary_candidates": []
    },
    {
      "entry_id": "022",
      "mesh_id": "body_right_hand",
      "collision_mesh_id": "body_collision_v1",
      "face_start": 1344,
      "face_end": 1423,
      "region_id": "body.hand.general",
      "laterality": "right",
      "surface": "lateral",
      "confidence": 0.86,
      "boundary_candidates": []
    },
    {
      "entry_id": "023",
      "mesh_id": "body_right_hip",
      "collision_mesh_id": "body_collision_v1",
      "face_start": 1424,
      "face_end": 1503,
      "region_id": "body.hip.general",
      "laterality": "right",
      "surface": "lateral",
      "confidence": 0.86,
      "boundary_candidates": []
    },
    {
      "entry_id": "024",
      "mesh_id": "body_right_knee",
      "collision_mesh_id": "body_collision_v1",
      "face_start": 1504,
      "face_end": 1583,
      "region_id": "body.knee.general",
      "laterality": "right",
      "surface": "lateral",
      "confidence": 0.86,
      "boundary_candidates": []
    },
    {
      "entry_id": "025",
      "mesh_id": "body_right_shoulder",
      "collision_mesh_id": "body_collision_v1",
      "face_start": 1584,
      "face_end": 1663,
      "region_id": "body.shoulder.general",
      "laterality": "right",
      "surface": "lateral",
      "confidence": 0.86,
      "boundary_candidates": []
    },
    {
      "entry_id": "026",
      "mesh_id": "body_right_thigh",
      "collision_mesh_id": "body_collision_v1",
      "face_start": 1664,
      "face_end": 1703,
      "region_id": "body.thigh.general",
      "laterality": "right",
      "surface": "lateral",
      "confidence": 0.86,
      "boundary_candidates": []
    },
    {
      "entry_id": "027",
      "mesh_id": "body_right_upper_arm",
      "collision_mesh_id": "body_collision_v1",
      "face_start": 1704,
      "face_end": 1743,
      "region_id": "body.upper_arm.general",
      "laterality": "right",
      "surface": "lateral",
      "confidence": 0.86,
      "boundary_candidates": []
    },
    {
      "entry_id": "028",
      "mesh_id": "body_right_upper_back",
      "collision_mesh_id": "body_collision_v1",
      "face_start": 1744,
      "face_end": 1823,
      "region_id": "body.upper_back.general",
      "laterality": "right",
      "surface": "posterior",
      "confidence": 0.86,
      "boundary_candidates": []
    },
    {
      "entry_id": "029",
      "mesh_id": "body_torso",
      "collision_mesh_id": "body_collision_v1",
      "face_start": 1824,
      "face_end": 1903,